{
  "contract_id": "content-pipeline-contract-001",
  "schema_version": "0.1",
  "objective": "Run a content workflow with explicit planning, review, approval, and artifact gates.",
  "domain": "content-operations",
  "task_type": "governed-content-pipeline",
  "required_agents": [
    {
      "agent_id": "content_planner",
      "role_spec": "Define audience, constraints, production steps, and acceptance criteria.",
      "execution_spec": "Create a content plan before drafting and block on missing brief requirements.",
      "output_spec": "Content plan with audience, constraints, artifacts, gates, and review criteria."
    },
    {
      "agent_id": "quality_reviewer",
      "role_spec": "Review claims, completeness, policy constraints, and approval readiness.",
      "execution_spec": "Approve only when evidence, review notes, and artifacts satisfy gates.",
      "output_spec": "Review report, approval state, blocked reasons, and missing evidence list."
    }
  ],
  "required_tools": [
    "draft_writer",
    "review_checker",
    "artifact_exporter"
  ],
  "required_evidence": [
    "content_brief",
    "review_notes",
    "approval_record"
  ],
  "gates": [
    {
      "gate_id": "brief_gate",
      "condition": "Brief contains audience, constraints, and required outputs.",
      "on_pass": "continue_to_draft",
      "on_failure": "blocked_missing_brief"
    },
    {
      "gate_id": "approval_gate",
      "condition": "Reviewer approval is present before release.",
      "on_pass": "release_approved_output",
      "on_failure": "blocked_unapproved_output"
    }
  ],
  "expected_artifacts": [
    "production_plan",
    "draft_package",
    "review_report",
    "approved_output"
  ],
  "failure_semantics": {
    "no_fake_success": true,
    "no_silent_fallback": true,
    "explicit_failure_state": true,
    "on_missing_evidence": "blocked",
    "on_gate_failure": "blocked",
    "on_export_failure": "failed"
  },
  "execution_constraints": {
    "no_fake_success": true,
    "no_silent_fallback": true,
    "no_hardcoded_fallback": true,
    "approval_required_before_release": true
  },
  "human_approval": {
    "required": true,
    "before": [
      "release"
    ]
  },
  "verification_policy": {
    "required_checks": [
      "schema_v0_1",
      "required_fields",
      "gate_shape",
      "failure_semantics",
      "approval_record"
    ]
  },
  "unsupported_features": []
}
