{
  "contract_id": "software-refactor-contract-001",
  "schema_version": "0.1",
  "objective": "Refactor software while preserving public behavior and explicit verification evidence.",
  "domain": "software-engineering",
  "task_type": "behavior-preserving-refactor",
  "required_agents": [
    {
      "agent_id": "refactor_planner",
      "role_spec": "Identify behavior boundaries, affected files, risks, and required verification.",
      "execution_spec": "Inspect source and tests before edits and block when behavior boundaries are unknown.",
      "output_spec": "Scoped refactor plan with behavior inventory, file list, risks, and checks."
    },
    {
      "agent_id": "verification_reviewer",
      "role_spec": "Verify that behavior is preserved and success claims are supported.",
      "execution_spec": "Run checks, inspect diff, and fail closed on missing or failed verification.",
      "output_spec": "Verification report with commands, results, diff summary, and remaining risks."
    }
  ],
  "required_tools": [
    "source_reader",
    "test_runner",
    "diff_inspector"
  ],
  "required_evidence": [
    "public_behavior_inventory",
    "test_results",
    "diff_summary"
  ],
  "gates": [
    {
      "gate_id": "scope_gate",
      "condition": "Public behavior boundaries and affected files are listed before edits.",
      "on_pass": "continue_to_refactor",
      "on_failure": "blocked_missing_scope"
    },
    {
      "gate_id": "verification_gate",
      "condition": "Relevant tests or equivalent checks pass after refactor.",
      "on_pass": "release_patch",
      "on_failure": "failed_verification"
    }
  ],
  "expected_artifacts": [
    "refactor_plan",
    "patch_summary",
    "verification_report"
  ],
  "failure_semantics": {
    "no_fake_success": true,
    "no_silent_fallback": true,
    "explicit_failure_state": true,
    "on_missing_evidence": "blocked",
    "on_gate_failure": "blocked",
    "on_test_failure": "failed"
  },
  "execution_constraints": {
    "no_fake_success": true,
    "no_silent_fallback": true,
    "no_hardcoded_fallback": true,
    "preserve_public_behavior": true
  },
  "human_approval": {
    "required": false,
    "before": []
  },
  "verification_policy": {
    "required_checks": [
      "schema_v0_1",
      "required_fields",
      "gate_shape",
      "failure_semantics",
      "test_results"
    ]
  },
  "unsupported_features": []
}
